Ads_ASIN,Ads_Title,Ads_DESCOR,Ads_DESLAR
B000CITK8S,"Battery Tender 021-0123 Battery Tender Junior 12V, 0.75A Battery Charger","Code 1541011288851 See more product details || Spark proof during lead connection, reverse polarity protected and includes a 12-foot output cord and 5-year warranty<br>Perfect for charging all 12-volt lead-acid, flooded or sealed maintenance free batteries (AGM and gel cell) and safety timer-80 hours<br>Complete 4-step charging program (Initialization, Bulk Charge, Float Mode) allows for optimization of battery power, without overcharging<br>Automatic charge cycle functionality switches to float mode after fully charging the battery<br>Solid state two color LED indicates stage of charger and if the battery voltage drops too far under load, full charger output power resumes<br>It will charge and maintain your battery so that it is ready to go when you are! It's lightweight, fully automatic and easy to use","Battery Tender Junior 12V Battery Charger is much more than a trickle charger. It has a brain, is lightweight, compact, fully automatic and very easy to use especially in small spaces. This battery charger will keep the battery fully charged so that it is ready to go always. It has a microprocessor controlled fully automatic charger and maintainer and is designed to extend the life of any lead acid battery commonly used in automobiles, motorcycles, ATVs, personal watercraft, RVs, boats, airplanes, golf carts, back-up generator systems, etc. Any vehicle or battery-operated piece of equipment not used on a daily or regular basis is a candidate for a Battery Tender charger. The advanced technology will bring the battery back to a full charge without overcharging and then float or maintain the battery for an indefinite period of time. The Battery Tender Junior comes equipped with alligator clips and ring terminals for easy hook up. An optional 25 feet extension cord (part number 081-0148-25) is sold separately. || From the manufacturer<br>View larger<br>Battery Tender Junior Benefits and Features<br>Smart Microcontroller<br>Our onboard computer assures correct level of power is sent to the battery at all times.<br>ISM Adaptive Charging<br>ISM (Infinite Sequential Monitoring) adapts to the battery’s needs hundreds of times per second.<br>Reversed Hook-Up Protection<br>Battery Tender checks for a correct connection before giving power.<br>Sparkproof<br>Battery Tender checks for a correct connection before giving power.<br>Quick Disconnect Harness<br>Connect and disconnect Battery Tender Junior in seconds.<br>Connect and Forget It<br>Once connected, the Battery Tender manages your battery’s health on it’s own.<br>Ideal for Motorcycles, ATVs, Scooters, and Automobiles.<br>Technical Details:<br>- Input Voltage: 120VAC / 60Hz.<br>- Output Voltage: 12 Volts DC @ .750 MA.<br>- Shipping Weight: 2 Lbs.<br>- Agency Approvals: UL/CSA.<br>- P/N# 021-0123.<br>View larger"
B004LWVEKS,NOCO Genius G3500 6V/12V 3.5A UltraSafe Smart Battery Charger,"Code 1541011297644 See more product details || A 6-volt and 12-volt battery charger and maintainer for lead-acid and lithium-ion batteries up to 120 amp-hours<br>An ultra-safe design featuring spark-proof technology, as well as reverse polarity and overcharge protection. Types of Batteries - Suitable for Wet Cell (Flooded), Gel Cell, Calcium, Lithium-Ion, AGM, Enhanced Flooded Battery or any Maintenance-Free Battery<br>Safely charge automotive, marine, RV, powersport and lawn & garden batteries, as well as, AGM and deep-cycle batteries<br>Actively monitors the batteries health and repairs discharged and sulfated batteries for improved battery life<br>Charge a motorcycle, snowmobile, ATV, personal watercraft, lawn mower and more, or simply maintain all types of vehicles","NOCO Genius smart battery chargers are some of the safest and most advanced on the market. One of our best, the G3500 3.5 Amp is designed to charge 6-volt and 12-volt lead-acid and lithium-ion batteries up to 120Ah. It can also effectively maintain automotive, marine, RV, powersport, lawn & garden and deep-cycle batteries. It charges 2x faster than ordinary battery chargers, can repair damaged batteries and is designed for use with micro-hybrid start-stop vehicles and CANBUS electrical systems.<br>Guided by an onboard microcomputer, the G3500 monitors battery activity for safe and efficient charging, automatically minimizes energy consumption and provides redundant levels of safety protection, including spark-proof technology, as well as reverse polarity and overcharge protection. It can remain safely connected 24/7, while its streamlined design makes it ultra-compact, portable, and incredibly lightweight.<br>The G3500 features external mounting holes and a rubberized base that avoids surface slipping and scratches, while remaining impact, UV and water-resistant (IP65). Intuitive LED indicators provide visual state-of-charge feedback and diagnostic information, even when in maintenance mode. Designed for use on 120-volt 50-60Hz electrical systems, the G3500 includes both X-Connect battery clamps with integrated eyelet terminals, as well as a 5-year limited warranty.<br>Other commonly used search terms include: 12 volt battery charger,12 volt battery maintainer,12 volt motorcycle trickle charger,12 volt trickle charger,12v 24v battery charger,12v auto battery charger,12v battery charger,12v battery trickle charger,12v car battery charger,12v trickle charger,24 volt battery charger,24 volt trickle charger,24v 12v battery charger,24v battery and charger,24v battery charger,24v battery chargers,24v trickle charger,auto battery charger,automobile battery charger,automotive battery charger,automotive battery chargers,battery charger,battery charger auto,battery charger car,battery charger portable,battery charger automotive,battery charger scooter,battery charger 12v,battery chargers,battery maintainer,battery maintainer 12 volt,battery trickle charger,battery trickle charger with float mode,car battery charger,car battery charger and starter,car battery charger maintainer,car battery charger portable,car battery charger with jump start,car battery chargers,car battery chargers 12 volt,car battery trickle charger,harley davidson trickle charger,manual battery charger,marine battery charger,marine battery trickle charger,mini car battery charger,motorcycle battery maintainer,motorcycle trickle charger,noco battery,noco battery charger,noco genius,noco genius chargers,noco,portable auto battery charger,portable battery charger,portable car battery charger,portal car battery charger,rv solar 12v battery charger,smart battery charger,solar 12v battery charger,solar 12v car battery charger,solar battery charger,solar battery maintainer,solar battery maintainer 12 volt,solar car battery charger,solar car battery chargers,solar power 12v battery charger,solar trickle charger,trickle charger,trickle charger car battery,trickle charger for atv,trickle charger for boat battery,trickle charger for car battery,trickle charger for motorcycle,trickle chargers,waterproof trickle charger,battery desulfator || From the manufacturer<br>The NOCO Genius G3500 is a portable automatic battery charger and maintainer<br>7 Chargers In One<br>Designed for charging starter and deep-cycle 12V and 6V lead-acid batteries, including COLD/AGM mode and 12V lithium.<br>Diagnostics<br>Intuitive visual diagnostic tool for detecting reverse polarity, low-voltage or damaged batteries.<br>Recovery<br>Applies a high-voltage pulse charge when low-voltage, sulfation or lost capacity is detected.<br>CANbus<br>Automatically enables the charging port to charge CANbus systems.<br>Protects against reverse polarity, overcharging, open-circuits, short-circuits, and overheating.<br>Maintenance Plus<br>Keeps the battery fully charged without overcharging, indefinitely.<br>Optimization<br>Stabilizes internal battery chemistry for increased performance and longevity.<br>Interactive<br>Alters the charging process based on organic battery feedback.<br>Energy-Save<br>Minimizes energy consumption when full power is not needed.<br>Model G750 G1100 G3500 G7200 G15000 G26000<br>Power 0.75A 1.1A 3.5A 7.2A 15A 26A<br>Battery Voltage 6V & 12V 6V & 12V 6V & 12V 12V & 24V 12V & 24V 12V & 24V<br>Cold/AGM Mode ✓ ✓ ✓ ✓ ✓<br>12V Lithium Mode ✓ ✓ ✓ ✓ ✓<br>Small Battery Mode ✓<br>12V Repair Mode ✓ ✓ ✓ ✓<br>12V Supply Mode ✓ ✓ ✓<br>12V AGM+ ✓ ✓ ✓<br>JumpCharge Vehicle Starting ✓ ✓"
B06XDJZC1M,DEWALT DXAEC80 30 Amp Bench Battery Charger with 80 Amp Engine Start and 2 Amp Maintainer,"Code 1541011300100 See more product details || 30 Amp continuous output, 80 Amp engine start<br>Dual battery capability - charge two batteries at once (extra charging cables not included)<br>Battery voltage check - Battery recondition – Alternator check functions<br>Pass through 120V AC and USB power outlets<br>Heavy duty cables and powder coated metal clamps and reverse polarity alarm<br>Note: Please refer the user manual below for better use","The DEWALT professional dual battery bench charger has all the features that you need, whether you are a pro or a beginner. This high frequency, true 3 stage dual battery charger is fully automatic and delivers a continuous 30 amps of power with a patented 80 Amp engine start feature for a quick start. The DEWALT 30 Amp charger is also fully featured, with the ability to charge 2 batteries at once (extra set of charging cables not included). It includes the following functions as well; battery voltage check, battery re-condition and a patented alternator check function. In the event, you are not a pro at charging 12 volt batteries, it features a reverse polarity alarm to make sure you have the clamps hooked to the correct battery charging posts. Note: Please refer the user manual below for better use || From the manufacturer<br>View larger<br>Professional Grade 30 Amp High Frequency Battery Charger with 80 Amp Engine Start<br>View larger<br>View larger<br>View larger<br>30 Amp Continuous Output, 80 Amp Engine Start<br>The DXAEC80 pumps up to 30 continuous amps into your battery, charging it quickly and efficiently. The patented high frequency feature makes sure your battery is analyzed and charged at the proper rate. Once it's full, it shuts off. And if you need to start your vehicle quickly, the 80 amp engine start feature will start it in around 60 seconds.<br>Powder Coated Heavy Duty Metal Clamps and Cables<br>When it's cold, plastic clamps crack and break. The DXAEC80 has robust heavy duty cables and powder coated metal clamps. No matter how cold it is, our clamps will not break. This is good news if you live where it gets cold.<br>Dual Charging Banks and One Touch Buttons<br>The DXAEC80 allows you to charge two 12 Volt batteries simultaneously (extra cables sold separately).<br>View larger<br>View larger<br>View larger<br>Single 3.1 Amp USB Outlet<br>Cell phones, tablets and anything else that needs to be charged up through a USB outlet, the DXAEC80 has you covered.<br>120 Volt Pass Through AC Outlet<br>When you plug the DXAEC80 into the wall to charge your battery, you lose an outlet. Well, we gave ti back to you in the form of a convenient auxiliary 120 Volt AC power outlet.<br>Engine Alternator Diagnostic Function<br>Sometimes it's not your battery that is causing your vehicle to not start. Often times it's your alternator. This function will tell you if your alternator is working correctly.<br>View larger<br>View larger<br>View larger<br>View larger<br>Variety of Battery Types? No Problem!<br>The DXAEC80 will work with any 12 Volt Wet, Gel or AGM battery.<br>Extend the Life of Your Battery<br>Over time, the lead plates in a 12 Volt battery will start to sulfate. The Battery Recondition function with electric pulse technology will help reverse this process. This not only increases the charge capacity but also extends the life of the battery.<br>Need a Quick Start?<br>The DXAEC80 80 Amp Engine Start feature will jump start your vehicle in 60 seconds or less.<br>Two Battery Charging Banks<br>You can charge two 12 Volt batteries with the DXAEC80 multi-bank charging function. (extra cables sold separately)<br>View larger<br>View larger<br>View larger<br>View larger<br>Two is Better Than One!<br>The DXAEC80 allows you to charge two batteries at once. (Extra charging cables sold separately).<br>Easy to Read. Easier to Use<br>Choose your desired function, push the button and the DXAEC80 does the rest. Simple and safe!<br>Safety First!<br>The DXAEC80 will not allow the charger to function if the clamps are connected incorrectly. And with this protection there is no more sparks! Charge with complete confidence.<br>Battery Voltage Meter<br>With the touch of a button, the current voltage of your battery will be displayed on the LCD screen."
B0756MDZ1L,Schumacher SC1305 2/10/50A 12V Automatic Battery Charger with Engine Start,"Code 1541011301438 See more product details || Microprocessor-controlled, with multi-stage charging for added precision, safety, and battery life<br>Charges compatible battery types, including standard and AGM batteries<br>Reverse hook-up protection ensures charger will not operate if clamps are reversed<br>Float-mode monitoring automatically maintains optimum battery charge<br>Meets the highest industry standards for energy efficiency","Schumacher's 2/10/50A 12V fully automatic batter charger/engine starter is microprocessor-controlled to automatically adjust the amperage rate to charge and maintain, with multi-stage charging for added precision, safety, and battery life. Charges compatible battery types, including standard and AGM batteries. Reverse hook-up protection ensures charger will not operate if clamps are reversed. Float-mode monitoring automatically maintains optimum battery charge. Meets the highest industry standards for energy efficiency. || null"
B0051D3MP6,BLACK+DECKER BM3B Multi 1.5 Amp Battery Maintainer/Trickle Charger,"Code 1541011314456 See more product details || Battery Maintainer for use on 6V & 12V battery systems. Charges 6 and 12 volt AGM, GEL and WET batteries<br>Easy connection to vehicle battery using the included battery clips, O-ring terminals or vehicle DC plug<br>High-frequency smart charging technology keeps batteries at optimal charge<br>Automatically switches between charging mode and float mode monitoring<br>Built-in mounting bracket. AC Low voltage compensation ensures maximum performance when used with an extension cord","The Black & Decker BM3B battery charger/maintainer features 6 volt and 12 volt charging selectivity. Use for battery maintenance, charging RVs, specialty vehicles, antique and classic cars, marine deep cycle batteries, motorcycles, lawn mowers, ATVs, snowmobiles, personal watercraft and more. Maintains battery charge in stored vehicles and battery applications. Includes three connector sets: DC accessory plug, battery clips, and battery ring terminals. Fully automatic, provides a charge when needed, stops charging when battery is fully-charged or topped-off. Built-in circuit protection guards against overcharging, reverse polarity or short circuit. || From the manufacturer<br>View larger<br>Black & Decker BM3B Battery Charger and Maintainer<br>Say goodbye to dead vehicle batteries!<br>Nothing is more maddening than a dead vehicle battery. And it usually happens when you need it least. To solve this problem, Black & Decker has the answer with their 1.5 amp high frequency battery charger / maintainer.<br>What is a high frequency battery charger / maintainer you ask? It’s simple. ..if you have a vehicle battery and do not know how long to charge it up, or what type of battery it is, or whether you can leave it connected all season long. ..then this is the battery charger / maintainer for you. The Black & Decker Charger / Maintainer takes all the guesswork out of charging and maintaining your battery, no matter what season it is.<br>Whether you have a car, truck, boat, motorcycle, RV, lawn tractor, or any other vehicle with a 6 or 12-volt battery, simply hook the Black & Decker charger / maintainer up to the battery (you have three choices on how to do this), choose the 6 or 12-volt option, plug it in and walk away. It does all the thinking for you. It’s the perfect choice when the last thing you want to think about is your battery.<br>Features<br>1.5 amp charger / maintainer<br>For 6 or 12 volt batteries<br>Sealed for protection against moisture, dust and oil<br>Mounting brackets<br>I year limited warranty<br>View larger<br>View larger<br>View larger<br>Battery Clamps<br>One of three ways to connect to your battery for charging or maintaining.<br>O-Rings<br>Great way to connect to your battery if you are charging it for an extended period of time, like during the off season.<br>DC Plug<br>If you prefer to charge / maintain your battery from inside your vehicle this is a great option. Simply use the DC plug with your vehicle’s accessory outlet. No touching your battery means your hands stay clean!<br>View larger<br>View larger<br>View larger<br>View larger<br>Select the mode in which you will connect to your battery by using the quick connect attachments with the charger / maintainer.<br>First connect the clamps or O-rings to your battery. You may also charge your battery by using the DC plug with your vehicle’s accessory (cigarette lighter) outlet.<br>You may also choose to charge your vehicle’s battery outside of the vehicle. This is a good option if you are charging a boat battery or a battery that is being maintained during the off season.<br>Once you have chosen your method to connect to your battery, slide the switch to either 6 or 12-volt depending on your battery, plug it in and walk away! It’s that simple.<br>BM3B BC2BDW BC6BDW BC15BD BC25BD<br>Power 0-1.5 Amps 0-2 Amps 0-6 Amps 0-15 Amps 0-25 Amps<br>Battery voltage 6-12 volts 12 volts 12 volts 12 volts 12 volts<br>One Touch Automatic Charging No touch No touch No touch ✓ ✓<br>Reverse Polarity Protection ✓ ✓ ✓ ✓ ✓<br>Alternator Check Feature ✓ ✓<br>Battery Recondition Feature ✓ ✓<br>AGM / GEL / WET ✓ ✓ ✓ ✓ ✓<br>Engine Start Feature ✓ ✓<br>ETL / CEC Compliant ✓ ✓ ✓ ✓ ✓<br>Waterproof ✓ ✓"
B00HWL4N08,BLACK+DECKER BC6BDW 6 Amp Waterproof Automatic Battery Charger/Maintainer,"Code 1541011313572 6 amp battery charger/maintainer is compatible with any AGM, GEL, or WET automotive or marine 12V battery<br>Fully automatic high frequency charging; AC low-voltage compensation ensures maximum performance when used with extension cords<br>Features an IP67 rating which certifies a completely sealed, waterproof and dust proof housing capable of withstanding direct water or rain exposure<br>Built-in circuit protection guards against overcharging, reverse polarity, and short circuiting; ETL Certified for performance and safety<br>Offers 2 ways to connect: 12V DC accessory plug or battery clamps, Hanging hook allows for convenient, hands-free operation || 6 amp battery charger/maintainer is compatible with any AGM, GEL, or WET automotive or marine 12V battery<br>Fully automatic high frequency charging; AC low-voltage compensation ensures maximum performance when used with extension cords<br>Features an IP67 rating which certifies a completely sealed, waterproof and dust proof housing capable of withstanding direct water or rain exposure<br>Built-in circuit protection guards against overcharging, reverse polarity, and short circuiting; ETL Certified for performance and safety<br>Offers 2 ways to connect: 12V DC accessory plug or battery clamps, Hanging hook allows for convenient, hands-free operation","The BLACK+DECKER BC6BDW 6 amp battery charger/maintainer features a robust waterproof design and waterproof connectors, making this the ideal charger even in the most challenging environments. It's perfect for motorhomes, boats, jet skis, lawn tractors, ATVs, snowmobiles, and vehicles that sit idle for months at a time. It features an IP67 rating which certifies a completely sealed, waterproof and dust proof housing capable of withstanding direct water or rain exposure. This unit maintains battery charge in stored vehicles and features 3 ways to connect: 12V DC accessory plug or battery clamps. The BLACK+DECKER BC6BDW 6 amp battery charger/maintainer is fully automatic and incorporates true high frequency technology, to deliver and maintain the charge in any AGM, GEL, or WET automotive or marine 12V battery. It offers built-in circuit protection guards against overcharging, reverse polarity, and short circuiting. A hanging hook allows you to position the unit for convenient, hands-free operation. California Energy Commission (CEC) compliant and ETL Certified for performance and safety. || From the manufacturer<br>View larger<br>Black & Decker BC6BDW 6 Amp Waterproof Battery Charger and Maintainer<br>Put an end to dead batteries forever!<br>Black & Decker knows what a hassle a dead battery can be, which is why they created the fully waterproof BC6BDW battery charger/maintainer. This charger is fully automatic, removing all the guess work out of charging your batteries. The BC6BSW has the ability to identify the level of charge on any type of battery and maintain a level of maximum charge and with it's high frequency charging technology, you can simply plug in the BC6BSW and walk away confident that your battery will be fully charged and ready for use.<br>Waterproof charging<br>With Black & Decker's unique waterproof battery charger system, now you can charge batteries anywhere, including outside in the elements and even on your boat without worry of an accident. And because this is a high frequency battery maintainer, the charger can be left connected for any length of time, allowing you to continuously maintain a charge on all of your batteries, including lawn mowers, motorcycles, and personal watercraft.<br>Long lasting.<br>The BC6BSW is built to last, with a fully sealed outer case, protecting it from dust, oil, and moisture, to prevent corrosion or other damaging effects of weather exposure. Also includes a 1 year limited warranty.<br>0-6 amp charger/maintainer<br>Waterproof for outdoor use<br>Mounting brackets<br>1 year limited warranty<br>DC plug for charging inside or out<br>Includes two ways to use<br>View larger<br>View larger<br>View larger<br>View larger<br>Battery clamps<br>Battery clamps are ideal for use attaching charger to any type of battery terminals.<br>Easy charging<br>The battery clamps along with waterproof case work exceptionally well charging marine batteries.<br>In car charging<br>Excellent at charging car batteries while the battery is still in the car, rain or shine.<br>DC plug<br>If you prefer to charge / maintain your battery from inside your vehicle this is a great option. Simply use the DC plug with your vehicle’s accessory outlet. No touching your battery means your hands stay clean!<br>BM3B BC2BDW BC6BDW BC15BD BC25BD<br>Power 0-1.5 Amps 0-2 Amps 0-6 Amps 0-15 Amps 0-25 Amps<br>Battery voltage 6-12 Volts 12 Volts 12 Volts 12 Volts 12 Volts<br>One Touch Automatic Charging No touch No touch No touch ✓ ✓<br>Reverse Polarity Protection ✓ ✓ ✓ ✓ ✓<br>Alternator Check Feature ✓ ✓<br>Battery Recondition Feature ✓ ✓<br>AGM / GEL / WET ✓ ✓ ✓ ✓ ✓<br>Engine Start Feature ✓ ✓<br>ETL / CEC Compliant ✓ ✓ ✓ ✓ ✓<br>Waterproof ✓ ✓"
