Ads_ASIN,Ads_Title,Ads_DESCOR,Ads_DESLAR
B0009IBJE4,Schumacher SSC-1000A SpeedCharge 2/6/10 Amp Battery Charger and Maintainer with 50-Amp Battery Clips,"Code 1541011314493 See more product details || Electronic push button select between display mode, charge rate, or battery<br>Digital meter helps to display battery charge status and test results<br>System test helps to diagnose problems with battery and charging system<br>10-amp fast charge monitors battery condition and adjusts charge rate<br>2-amp slow charge helps charge small batteries or maintains large one for motorcycles, snowmobiles, and lawn tractor batteries. Item SSC-1000A is not available for sale in California or Oregon due to CEC restrictions. The CEC compliant equivalent item is SSC-1500A-CA.<br>This product cannot be shipped to Oregon or California<br>Not compatible with the WM-12 or EC-25 quick connect cables","The Schumacher SSC-1000A Ship 'N' Shore SpeedCharge Charger is a versitile, fast and efficient 12-volt battery charger/maintainer suitable for use with a variety of lead-acid battery types used in everything from tractors, motorcycles, jetskiis and snowmobiles, to those found in cars, trucks and SUVs. It features fully automatic microprocessor control; automatic multi-stage charging allowing for ease of use; three charge rates: 2-amp, 6-amp and 10-amp; and the ability to choose the type of battery being charged. Addtiional features include a built-in voltage tester, a desulphation mode, a retractable handle and clamp/cable stowage compartment.<br>Charge and maintain multiple battery types at 3 Amp levels.<br>View larger.<br>Retractable handle & stowage area.<br>View larger.<br>Efficient multi-stage charging safely keeps batteries at optimal levels.<br>View larger.<br>Fast charging speeds across a variety of battery types.<br>View larger.<br>Fast, Automatic 12-Volt Battery Charging<br>By combining conventional battery charging technology with state-of-the-art circuitry, the Schumacher SSC-1000A Ship 'N' Shore SpeedCharge Charger offers greater versatility, speed of charging and convenience than ever before seen in a battery charger. The charger features an easy-to-use and monitor digital readout on which three output current rates are selectable: 2-amps, 6-amps and 10-amps. The readout also allows for the selection of battery type being charged: standard, AGM or gell cell; and provides data on based on quarter percentages of a full charge that is stored and voltage present at the poles of a charging battery. All these features and data are hightened by the prescence of a powerful microprocessor at the heart of the unit.<br>The microprocessor of the Schumacher SSC-1000A Ship 'N' Shore SpeedCharge Charger monitors the attached battery's voltage level from the moment it is connected, using this ever-changing data to improve the charging system's multi-stage charging cycle. Multi-stage charging allows a battery charger to automatically cycle, between a variety of charging phases including desulphation, bulk charging, absorbtion, monitoring, float mode and a minimal drip charge maintain mode when a connected battery again falls below a certain set level. The microprocessor collected data is especially important in this cycle in that with it the SSC-1000A can more accurately measure the charging needs of a connected battery, resulting in quicker charge times and a lessened chance of damage due to overcharging.<br>2-Amp, 6-Amp and 10-Amp Charging Rates<br>An additional key to the speed with which the Schumacher SSC-1000A Ship 'N' Shore SpeedCharge Charger works is its three available charging rates: 2-amp, 6-amp and 10-amp. By allowing users to choose the best rate for the right battery type and charging needed, the SSC-1000A is able to better supply exactly the right level of charge, at the right time in the charging cycle to get quick results and maintain connected batteries at their proper levels. Details on the three available charging rates include:<br>10-amp Fast Charge – Charger monitors battery condition and adjusts charge rate to prevent battery damage; for car, truck, marine, RV, farm equipment, AGM, gel cell and deep-cycle batteries.<br>6-amp Medium Charge – A self-adjusting charge rate for everyday charging needs and keeping your battery in peak condition.<br>2-amp Slow Charge – A gentle trickle charge for charging and maintaining small batteries; charges motorcycle, ATV, snowmobile and lawn tractor batteries.<br>Specifications<br>Charger Type - Fully automatic microprocessor controlled<br>Output Voltage - 12 VDC<br>Input Voltage - 120 VAC<br>Output Current Cont: 2A/6A/10A<br>Output Wattage - 167 Watts<br>Intput Current Cont: 0.0A/2.0A/3.0A<br>Dimensions - 7.59"" H x 3.54"" W x 9.68"" D<br>Product Weight - 2.98 lbs.<br>RoHS Compliant - Yes<br>Retrachtable Carrying Handle - Yes<br>Non-skid Features - Yes (4 small rubberized feet)<br>Stowage Compartment for Battery Clamps and AC Cord - Yes<br>What's in the Box<br>Schumacher SC-1000A SpeedCharge Battery Charger/Maintainer with included 50-amp battery clips<br>Users manual and warranty information (English and Spanish)<br>Five-Year Limited Warranty<br>Schumacher Electric Corporation (the ""Manufacturer"") warrants this battery charger / maintainer for five (5) years from the date of purchase at retail against defective material or workmanship that may occur under normal use and care. If your unit is not free from defective material or workmanship, Manufacturer's obligation under this warranty is solely to repair or replace your product with a new or reconditioned unit at the option of the Manufacturer. It is the obligation of the purchaser to forward the unit, along with mailing charges prepaid to the Manufacturer or its authorized representatives in order for repair or replacement to occur.<br>About Schumacher Electric Corporation<br>Since 1947, Schumacher Electric Corporation has been leading change and driving performance to exceed its customers' expectations. Engineered patent pending technologies and award winning marketing allows Schumacher to be the brand of choice when it comes to portable power and battery charger/jump starter/maintainer/tester needs. Passion and commitment is the Schumacher way which shows as they are official supplier for chargers, jump starters and inverters for NASCAR. || From the manufacturer<br>Schumacher SSC-1000A SpeedCharge 2/6/10 Amp Battery Charger and Maintainer<br>By combining conventional battery charging technology with state-of-the-art circuitry, the Schumacher SSC-1000A Ship 'N' Shore SpeedCharge Charger offers greater versatility, speed of charging and convenience than ever before seen in a battery charger. Choose from three rates for charging and maintaining. It’s easy to use, with a digital display and push-button controls. The retractable handle adds easy portability.<br>Features<br>Microprocessor controlled<br>2/6/10 Amp output<br>Fully automatic<br>View larger<br>View larger"
B000CIPHUI,Battery Tender 022-0148-DL-WH 12-Volt 4-Bank Battery Management System,"Code 1541011312347 Show more || Contains four independent stations capable of simultaneously charging at 12 volts/1.25 amps per charging bank<br>Perfect for all AGM (absorbed glass mat), sealed maintenance free and flooded batteries<br>Microprocessor-controlled constant current charging and temperature compensated to ensure optimum charge voltage according to ambient temperature<br>Extremely lightweight at less than 3 lbs","The Battery Tender 12-volt/1.25-amp 4-Bank Battery Management System is designed to fully charge up to four 12-volt batteries simultaneously and maintain each at its proper storage voltage without the damaging effects caused by some trickle chargers. Compatible with all AGM (absorbed glass mat), sealed maintenance free and flooded batteries commonly found in some automotive/farm equipment, motorcycles, ATV’s, and personal watercraft, this lightweight, microprocessor controlled unit provides safe, constant, four-step charging current for every vehicle stored in your garage, shop, barn or boathouse.<br>Simultaneous charging of four separate lead acid battery batteries, including AGM and gel cell.<br>View larger.<br>The 4-step charge cycle detailed.<br>View larger.<br>Safe, Smart, 4-step Battery Charging<br>The Battery Tender 12-volt/1.25-amp 4-Bank Battery Management System is much more than a trickle charger. Utilizing a 4-step charging program (initialization, bulk charge, absorption mode and float mode), it allows users to simply connect the charger to up to four batteries, either in or out of a vehicle and forget about it until you are ready to use it, with the confidence that the batteries in all four vehicles are being maintained at optimal performance levels. This makes it perfect for seasonal and recreational vehicles like motorcycles, jet skis, ATV's, snowmobiles and more,. It is also safe for your battery because it utilizes advanced microprocessor technology that automatically switches its output voltage to a storage or float level. This feature eliminates the need to worry about the damaging effects of overcharging, and the resulting need to check on the condition of a charging battery. If or when the battery voltage drops too far under load, this same smart technology resumes output power and the charging cycle begins again. The unit also features spark-proof connectors, short circuit and reverse polarity protection, an easy to understand charging status LED indicator for each charging bank, durable yet lightweight construction and almost no current draw from batteries connected to it.<br>Key Features:<br>Four independent charging stations.<br>12 volts/1.25 amps per charging bank.<br>Extremely lightweight at less than 3 lbs.<br>Operates anywhere in the world. 100-240 VAC, 50/60 Hz.<br>Microprocessor controlled constant current charging.<br>Spark-proof and reverse polarity/short circuit protected.<br>Temperature compensated to ensure optimum charge voltage according to ambient temperature.<br>Perfect for all AGM (absorbed glass mat), sealed maintenance free and flooded batteries.<br>Designed to meet U.S. and International product safety standards (UL/CE).<br>2-year warranty.<br>Charger Models<br>Output Voltage<br>Output Current<br>Charging Software*/<br>Battery Type AC Voltage/<br>Frequency Input<br>(Volts)<br>(Amps)<br>Battery Tender Junior 6V Battery Charger 6V 0.750A 3 Step STD & AGM 120 VAC, 60 Hz<br>Battery Tender Junior 12V Battery Charger 12V 0.750A 4 Step STD & AGM 120 VAC, 60 Hz<br>Waterproof 800 12V Battery Charger 12V 0.800A 3 Step STD & AGM 100 to 240 VAC, 50/60 Hz<br>Battery Tender Plus 6V Battery Charger 6V 1.25A 4 Step STD & AGM 120 VAC, 60 Hz<br>Battery Tender Plus 12V Battery Charger 12V 1.25A 4 Step STD & AGM 120 VAC, 60 Hz<br>Battery Tender Plus 12V Battery Charger (Gel Cell) 12V 1.25A 4 Step STD & AGM or GEL 120 VAC, 60 Hz<br>Battery Tender Twin 800 12V Dual Battery Charger 12V 0.800A 3 Step STD & AGM 100 to 240 VAC, 50/60 Hz<br>Battery Tender 12V 2-Bank Battery Management System 12V 1.25A 3 Step STD & AGM 100 to 240 VAC, 50/60 Hz<br>Battery Tender 12V 4-Bank Battery Management System 12V 1.25A 4 Step STD & AGM 100 to 240 VAC, 50/60 Hz<br>Battery Tender 12V 5-Bank Battery Management System 12V 2.0A 4 Step STD & AGM 120 VAC, 60 Hz<br>Battery Tender 12V 10-Bank Battery Management System 12V 2.0A 4 Step STD & AGM 120 VAC, 60 Hz<br>*Note: All Deltran battery chargers will charge all types of lead acid batteries: either flooded (standard STD), sealed maintenance free Absorbed Glass Mat (AGM), or sealed maintenance free gelled electrolyte (GEL) batteries. However, for optimum battery performance in deep cycle applications (for example, running a trolling motor), it is best to chose the Deltran charger that has the charging software specifically designed for the battery type. Fortunately, since the technical staff at Deltran has developed charging software that works equally well for both STD & AGM batteries, the only choice to be made is between 2 models: either STD & AGM or GEL software.<br>Two-Year Limited Warranty<br>Deltran provides a limited two-year warranty on its Battery Tender 12V 4-Bank Battery Management System to the original purchaser based on defective material or workmanship. Warranty is void in cases of product misuse, disassembly or modification. Other details regarding warranty limitations and procedures are contained in the Deltran Battery Tender Charger's general limited warranty information sheet enclosed with this product. || From the manufacturer<br>Battery Tender 4 Bank Battery Management System<br>Charge Multiple Batteries at the Same Time or Independently<br>The 4 Bank Battery Tender Battery Management System is four encased 1.25 amp battery chargers designed to fully charge a battery or batteries and maintain at proper storage voltage without the damaging effects caused by trickle chargers. This charger will operate anywhere in the world.<br>Lightweight and Easy to Mount on a Shelf or Ceiling<br>- Temperature Compensated.<br>- Spark Proof/ Reverse Polarity Protected.<br>- ISM Adaptive Charging Technology (Initialization, Bulk Charge, Absorption Mode, Float Mode)<br>- Includes 4 Alligator Clips and 4 Sets of Ring Terminals.<br>Microprocessor controlled constant current charging. Complies with US and international safety standards (UL/CE) and is listed in the California Appliance Efficiency Database.<br>Package Includes:<br>Four Sets of Alligator Clips.<br>Four Sets of Ring Terminals.<br>Smart Microcontroller<br>Our onboard computer assures correct level of power is sent to the battery at all times.<br>ISM Adaptive Charging<br>ISM (Infinite Sequential Monitoring) adapts to the battery’s needs hundreds of times per second.<br>Reversed Hook-Up Protection<br>Battery Tender checks for a correct connection before giving power.<br>Sparkproof<br>Battery Tender checks for a correct connection before giving power.<br>Quick Disconnect Harness<br>Connect and disconnect Battery Tender Junior in seconds.<br>Connect and Forget It<br>Once connected, the Battery Tender manages your battery’s health on it’s own."
B00KM18P5Y,BLACK+DECKER BC25BD 25 Amp Bench Battery Charger with 75 Amp Engine Start and Alternator Check,"Code 1541011323577 See more product details || 25 amp bench battery charger maintains and charges any AGM, GEL, or WET automotive or marine 12V battery<br>Fully automatic high frequency charging delivers 3 stage charging, automatically switching from fast charge, to top-off, to trickle charge<br>Battery reconditioning feature helps extend battery life; 75 amp engine start helps start your vehicle in about 90 seconds<br>Equipped with reverse polarity protection; LCD screen displays charging status and battery status with easy to understand icons<br>Features a patented alternator check which indicates if the alternator is maintaining battery level; ETL Certified for performance and safety","Get back on the road in minutes with the BLACK+DECKER BC25BD 25 amp bench battery charger with 75 amp engine start. Vehicle won't start? Battery needs maintenance? Just connect the battery charger clamps to the battery terminal and press charge. The bench battery charger automatically does the rest for optimum performance. Fully automatic high frequency charging delivers 3 stage charging, automatically switching from fast charge, to top-off, to trickle charge. This bench battery charger is ideal for motorhomes, boats, jet skis, lawn tractors, ATVs, snowmobiles, and vehicles that sit idle for months at a time. Charge and maintain any AGM, GEL, or WET automotive or marine 12V battery. It's equipped with a digital LCD screen that displays charging status and battery status with easy to understand icons. It also features a patented alternator check to evaluate the battery voltage under load to indicate if the alternator is maintaining battery level. This battery charger eliminates the need to manually input settings like battery type and size, and charges up to 40 percent faster than other conventional chargers. Need to get back on the road quickly? The BLACK+DECKER BC25BD bench battery charger also features a 75 amp engine start, which helps start your vehicle in about 90 seconds. The built-in cord, cable wrap, and clamp storage make this battery charger easy to use and store. California Energy Commission (CEC) compliant and ETL Certified for performance and safety. || From the manufacturer<br>View larger<br>Black & Decker BC25BD 25 Amp Bench Battery Charger with 75 Amp Engine Start<br>One of the most powerful 25 amp bench chargers available<br>Everyone knows how inconvenient a dead battery can be, but that frustration is a thing of the past with the BC25BD, the completely autonomous bench battery charger that takes all the guess work out of charging any type of battery you may have. With Black & Decker's patented 75 amp Engine Restart technology, this bench charger can start most dead vehicles within an amazing 90 seconds, whether it be an AGM, GEL or WET automotive or marine 12 volt battery.<br>Most advanced charger on the market<br>The BC15BD boasts many patented features unique to Black & Decker such as an alternator and battery voltage check gauge which is view able from a large LCD monitoring screen. The LCD screen displays information through easy to understand icons, monitors the electrical charge of your alternator and battery simultaneously, and even alerts if the battery clamps are connected to the incorrect terminals.<br>Completely worry free charging<br>Because the BC15BD was created with you in mind, everything is completely automated for more ease of use. Many other chargers require that you set various settings such as battery type and size but with the BC15BD you can simply plug in the charger and walk away knowing that everything will be done correctly, and with the capability of charging 40% faster than most conventional chargers, you will be back on the road in no time.<br>Fast and fully automatic high frequency technology with 75 Amp engine start feature<br>Easy to read icons<br>Monitor both battery and alternator simultaneously<br>CEC compliant and ETL Certified<br>The BC15BD is small and portable enough to charge your batteries indoors, and, when plugged into a wall socket, can provide continuous charging power.<br>With the included battery clamps, the BC15BD can easily charge your car's battery without having to remove your battery from your car.<br>BM3B BC2BDW BC6BDW BC15BD BC25BD<br>Power 0-1.5 Amps 0-2 Amps 0-6 Amps 0-15 Amps 0-25 Amps<br>Battery voltage 6-12 Volts 12 Volts 12 Volts 12 Volts 12 Volts<br>One Touch Automatic Charging No touch No touch No touch ✓ ✓<br>Reverse Polarity Protection ✓ ✓ ✓ ✓ ✓<br>Alternator Check Feature ✓ ✓<br>Battery Recondition Feature ✓ ✓<br>AGM / GEL / WET ✓ ✓ ✓ ✓ ✓<br>Engine Start Feature ✓ ✓<br>ETL / CEC Compliant ✓ ✓ ✓ ✓ ✓<br>Waterproof ✓ ✓"
B06XWDZ2KQ,"Motopower MP00205A 12V 800mA Fully Automatic Battery Charger/Maintainer Cars, Motorcycles, ATVs, RVs, Powersports, Boat More. Rescue Recover Batteries","Code 1541011330491 See more product details || [ Compact, Smart & Durable ] - It can charge all types of 12V lead-acid batteries, including flooded or sealed maintenance free batteries (AGM & gel cell). It's the best smart charger for automotive, motorcycle, marine, RV, Powersport, lawn&garden, children toys, etc.<br>[ Fully Automatic ] - No need of any manual operation, just plug and leave it for charging and maintaining your batteries automatically for long time. The microprocessor controlled program will monitor the whole charging progress and automatically stop when the battery is fully charged. Then it will monitor the battery voltage and maintain the battery with a float charging current. Zero output ( 0 Volt on DC port ) in standby mode without connecting with the battery to save energy.<br>[ Multi-level Safety Protection & Battery Rescue ] - Micro-processor Controlled program. No worry about overcharge, short circuit and reverse polarity. Spark-free technology applied. Featured Constant Pulse Current Maintenance function helps the battery avoid excessive charge and discharge. It will extend the battery life and recover batteries more effectively.<br>[ SAE Quick Release Adapters ] - With SAE quick release connection options: Ring Terminals (7.5amp fused for safety protection) or Alligator Clips. With the ring terminal harness connecting with the battery permanently, it's so easy to connect the charger by the SAE adapters when needed. Fuse protection will avoid danger of short circuit or overload.<br>[ Energy-save & International Standard ] - Energy Saving design with one LED indicator to display different charging status. Certified by CE, RoHS, UL and CEC. Conform to the CEC (​CALIFORNIA ENERGY COMMISSION) standard - BC mark. ONE YEAR LIMITED WARRANTY AND 100% SATISFACTION SERVICE - Hassle-free return or refund for any product quality issue. 100% satisfaction service and technical assistance will be provided by contacting our professional customer service team.","null || Product Description<br>The MOTOPOWER MP00205A 12V 800mA Automatic Batttery Charger/Maintainer can charge all types of 12V lead-acid batteries, including flooded or sealed maintenance free batteries (AGM & gel cell). It's the best smart charger for automotive, motorcycle, marine, RV, Powersport, lawn&garden, children toys, etc..<br>Input - 100-240V AC<br>Output - 12V DC, 800mA<br>Fully Automatic - No need of any manual operation, just plug and leave it for charging and maintaining your batteries automatically for long time.<br>Micropressor Controlled - The microprocessor controlled program will monitor the whole charging progress and automatically stop output when the battery is fully charged. Then it will monitor the battery voltage and maintain the battery with a float charging current.<br>Safety Protections - Multi-level safety barrier prevents unsafe and abnormal conditions. No worry about overcharge, short circuit and reverse palarity; Spark Free Technology.<br>Energy-Saving - Zero current draw from the battery and low power consumption. Comply with the highest energy saving standard.<br>Four-Stage Charge - Analysis, Bulk, Absorption and Maintenance.<br>Charge and Maintain all types of 12V lead-acid batteries<br>4 Charge Modes<br>Standard charge and maintain modes - Diagnostic, Bulk charge, Absorption and Maintain.<br>MCU Controlled Program<br>​Intelligent IC chip with smart charging program - Charge and Maintain the batteries properly.<br>Multi-level Safety<br>Protects against overcharging, short-circuits and reverse polarity.Spark Free Technology.<br>Energy-Save<br>ZERO battery draw.<br>Certified by ​CALIFORNIA ENERGY COMMISSION.<br>The MOTOPOWER MP00205A 12V 800mA Automatic Batttery Charger/Maintainer - The best choice for your batteries<br>Quick Connection<br>Standard SAE quick release connectors.<br>Easy operation and universal.<br>Accessoires<br>SAE alligator clamps cable and SAE Ring Terminal cable(fused) are included.<br>One LED Indicator<br>Energy-save design with one LED for indicating different charging modes.<br>International standard<br>Certified by the ETL(UL regulations), CEC(​CALIFORNIA ENERGY COMMISSION), CE and RoHS."
B00FZIOHMO,Schumacher (SE-2352-CA) 12V 200 Amp Automatic Wheel Battery Charger with Engine Start,"Code 1541011328296 See more product details || Microprocessor controlled fully automatic battery charger<br>Features three settings: 6 to 2 ampere charge/maintain, 35 ampere boost, and 200 ampere engine start<br>Temperature overload protection<br>LED indicators. Float mode monitoring ─ automatically maintains optimum battery charge<br>Includes heavy-duty clamps","Schumacher's 12 Volt 200 Ampere Fully Automatic Battery Charger with Engine Start is designed for energy efficient, yet extreme and rugged use. Features three settings: 6 to 2 ampere charge/maintain, 35 ampere boost, and 200 ampere engine start. This charger is microprocessor controlled with a heavy-duty transformer, and features LED indicators. Includes temperature overload protection and comes with heavy-duty clamps. CEC approved. || null"
B000NCI854,Schumacher SE-1510MA '100/15/2 Amp' 6V/12V Automatic Charger with Engine Start,"Code 1541011323643 For use with 6 and 12 Volt batteries, this charger is fully automatic and will not overcharge batteries<br>100 ampere engine start for emergency starting<br>15 ampere fast charge for charging a battery in 2 to 4 hours<br>2 ampere trickle charge for charging a small 12 Volt battery in 2 to 12 hours<br>2 LED lights signal full charge and check battery<br>This product cannot be shipped to Oregon or California<br>Not compatible with the WM-12 or EC-25 quick connect cables || For use with 6 and 12 Volt batteries, this charger is fully automatic and will not overcharge batteries<br>100 ampere engine start for emergency starting<br>15 ampere fast charge for charging a battery in 2 to 4 hours<br>2 ampere trickle charge for charging a small 12 Volt battery in 2 to 12 hours<br>2 LED lights signal full charge and check battery<br>This product cannot be shipped to Oregon or California<br>Not compatible with the WM-12 or EC-25 quick connect cables","Schumacher's Automatic Charger with Engine Start is for use with 6 and 12 Volt batteries and includes 2 LED lights to signal full charge and check battery. Features 100 ampere engine start for emergency starting, 15 ampere fast charge for charging a battery in 2 to 4 hours, and 2 ampere trickle charge for charging a small 12 Volt battery in 2 to 12 hours. This charger is fully automatic and will not overcharge batteries. || null"
